label,sentence
0,Needs more impressionistic cinematography and exhilarating point-of-view shots and fewer slow-motion 'grandeur' shots and quick-cut edits that often detract from the athleticism.
1,With the prospect of films like Kangaroo Jack about to burst across America's winter movie screens it's a pleasure to have a film like The Hours as an alternative.
0,"Where This was lazy but enjoyable, a formula comedy redeemed by its stars, That is even lazier and far less enjoyable."
1,"A highly watchable, giggly little story with a sweet edge to it."
1,Skillfully weaves both the elements of the plot and a powerfully evocative mood combining heated sexuality with a haunting sense of malaise.
0,"(Soderbergh) tends to place most of the psychological and philosophical material in italics rather than trust an audience's intelligence, and he creates an overall sense of brusqueness."
1,Writer-director Juan Carlos Fresnadillo makes a feature debut that is fully formed and remarkably assured.
0,The kind of film that leaves you scratching your head in amazement over the fact that so many talented people could participate in such an ill-advised and poorly executed idea.
0,"Each story is built on a potentially interesting idea, but the first two are ruined by amateurish writing and acting, while the third feels limited by its short running time."
1,"Sweetly sexy, funny and touching."
1,"Like all of Egoyan's work, Ararat is fiercely intelligent and uncommonly ambitious."
1,"Even if Invincible is not quite the career peak that The Pianist is for Roman Polanski, it demonstrates that Werner Herzog can still leave us with a sense of wonder at the diverse, marvelously twisted shapes history has taken."
0,The film is really closer to porn than a serious critique of what's wrong with this increasingly pervasive aspect of gay culture.
0,"This is a movie that starts out like Heathers, then becomes Bring it On, then becomes unwatchable."
1,It's a cool event for the whole family.
0,"Time literally stops on a dime in the tries-so-hard-to-be-cool ""Clockstoppers,"" but that doesn't mean it still won't feel like the longest 90 minutes of your movie-going life."
1,"A beautiful, entertaining two hours."
0,"Though it pretends to expose the life of male hustlers, it's exploitive without being insightful."
0,"Too long, and larded with exposition, this somber cop drama ultimately feels as flat as the scruffy sands of its titular community."
1,Another love story in 2002's remarkable procession of sweeping pictures that have reinvigorated the romance genre.
1,"The Chateau belongs to Rudd, whose portrait of a therapy-dependent flakeball spouting French malapropisms ... is a nonstop hoot."
1,"The story ... is inspiring, ironic, and revelatory of just how ridiculous and money-oriented the record industry really is."
0,"Love may have been in the air onscreen, but I certainly wasn't feeling any of it."
0,This director's cut -- which adds 51 minutes -- takes a great film and turns it into a mundane soap opera.
1,"""The Dangerous Lives of Altar Boys"" has flaws, but it also has humor and heart and very talented young actors"
0,Movies like High Crimes flog the dead horse of surprise as if it were an obligation.
1,"An amusing and unexpectedly insightful examination of sexual jealousy, resentment and the fine line between passion and pretence."
1,"Producer John Penotti surveyed high school students...and came back with the astonishing revelation that ""they wanted to see something that didn't talk down to them."""
0,It's just a movie that happens to have Jackie Chan in it.
1,"What redeems the film is the cast, particularly the Ya-Yas themselves."
1,But what's nice is that there's a casual intelligence that permeates the script.
0,Adam Sandler's 8 Crazy Nights is 75 wasted minutes of Sandler as the voice-over hero in Columbia Pictures' perverse idea of an animated holiday movie.
0,A mess.
1,"The filmmakers wisely decided to let Crocodile Hunter Steve Irwin do what he does best, and fashion a story around him."
1,So purely enjoyable that you might not even notice it's a fairly straightforward remake of Hollywood comedies such as Father of the Bride.
1,"Talk to Her is so darned assured, we have absolutely no idea who the main characters are until the film is well under way -- and yet it's hard to stop watching."
1,"A genuinely funny ensemble comedy that also asks its audience -- in a heartwarming, nonjudgmental kind of way -- to consider what we value in our daily lives."
1,"After seeing 'Analyze That,' I feel better already."
1,Mazel tov to a film about a family's joyous life acting on the Yiddish stage.
0,The characters are never more than sketches ... which leaves any true emotional connection or identification frustratingly out of reach.
1,Reign of Fire just might go down as one of the all-time great apocalypse movies.
1,"Though few will argue that it ranks with the best of Herzog's works, Invincible shows he's back in form, with an astoundingly rich film."
1,Monte Cristo smartly emphasizes the well-wrought story and omits needless chase scenes and swordfights as the revenge unfolds.
1,It shows us a slice of life that's very different from our own and yet instantly recognizable.
1,Interesting both as a historical study and as a tragic love story.
0,"What we have here isn't a disaster, exactly, but a very handsomely produced let-down."
0,There's a reason the studio didn't offer an advance screening.
1,"There is a certain sense of experimentation and improvisation to this film that may not always work, but it is nevertheless compelling."
1,"Though it's equally solipsistic in tone, the movie has enough vitality to justify the notion of creating a screen adaptation of Evans' saga of Hollywood excess."
0,One of the worst films of 2002.
0,"Lazy, miserable and smug."
0,"(T)he script isn't up to the level of the direction, nor are the uneven performances by the cast members, who seem bound and determined to duplicate Bela Lugosi's now-cliched vampire accent."
0,"Often demented in a good way, but it is an uneven film for the most part."
1,An animation landmark as monumental as Disney's 1937 breakthrough Snow White and the Seven Dwarfs.
0,This thing is just garbage.
1,"""the road paved with good intentions leads to the video store"""
1,"Still, this flick is fun, and host to some truly excellent sequences."
1,"A disoriented but occasionally disarming saga packed with moments out of an Alice in Wonderland adventure, a stalker thriller, and a condensed season of TV's Big Brother."
0,"Like the world of his film, Hartley created a monster but didn't know how to handle it."
1,What's surprising is how well it holds up in an era in which computer-generated images are the norm.
1,"It's a clear-eyed portrait of an intensely lived time, filled with nervous energy, moral ambiguity and great uncertainties."
1,The extent to which it succeeds is impressive.
1,"Proves a servicable World War II drama that can't totally hide its contrivances, but it at least calls attention to a problem Hollywood too long has ignored."
1,"A fascinating, bombshell documentary that should shame Americans, regardless of whether or not ultimate blame finally lies with Kissinger."
0,Never inspires more than an interested detachment.
1,"A sharp and quick documentary that is funny and pithy, while illuminating an era of theatrical comedy that, while past, really isn't."
1,"This is a smart movie that knows its classical music, knows its Freud and knows its Sade."
0,"Instead of trying to bust some blondes, (Diggs) should be probing why a guy with his talent ended up in a movie this bad."
1,Delivers roughly equal amounts of beautiful movement and inside information.
0,"Meyjes's movie, like Max Rothman's future, does not work."
1,"A weird, arresting little ride."
0,But I had a lot of problems with this movie.
0,"It's dull, spiritless, silly and monotonous: an ultra-loud blast of pointless mayhem, going nowhere fast."
1,"The year 2002 has conjured up more coming-of-age stories than seem possible, but Take Care of My Cat emerges as the very best of them."
1,"Nakata's technique is to imply terror by suggestion, rather than the overuse of special effects."
0,"The cinematic equivalent of patronizing a bar favored by pretentious, untalented artistes who enjoy moaning about their cruel fate."
1,There's a part of us that cannot help be entertained by the sight of someone getting away with something.
1,But Mr. Polanski creates images even more haunting than those in Mr. Spielberg's 1993 classic.
1,"The performances are strong, though the subject matter demands acting that borders on hammy at times."
0,"Never does ""Lilo & Stitch"" reach the emotion or timelessness of Disney's great past, or even that of more recent successes such as ""Mulan"" or ""Tarzan."""
1,A wild ride with eight boarders from Venice Beach that was a deserved co-winner of the Audience Award for documentaries at the Sundance Film Festival.
1,The mushy finale turns John Q into a movie-of-the-week tearjerker.
1,"A venturesome, beautifully realized psychological mood piece that reveals its first-time feature director's understanding of the expressive power of the camera."
1,that it'll probably be the best and most mature comedy of the 2002 summer season speaks more of the season than the picture
0,My own minority report is that it stinks.
1,Cage makes an unusual but pleasantly haunting debut behind the camera.
1,Brosnan is more feral in this film than I've seen him before and Halle Berry does her best to keep up with him.
1,"Ben Kingsley is truly funny, playing a kind of Ghandi gone bad."
0,"Frankly, it's pretty stupid."
1,Ozpetek's effort has the scope and shape of an especially well-executed television movie.
1,Too clever by about nine-tenths.
1,Horns and Halos benefits from serendipity but also reminds us of our own responsibility to question what is told as the truth.
0,"A particularly joyless, and exceedingly dull, period coming-of-age tale."
1,An unorthodox little film noir organized crime story that includes one of the strangest love stories you will ever see.
1,"Watching The Powerpuff Girls Movie, my mind kept returning to one anecdote for comparison: the cartoon in Japan that gave people seizures."
0,There's no good answer to that one.
1,"(While The Last Metro) was more melodramatic, confined to a single theater company and its strategies and deceptions, while Tavernier is more concerned with the entire period of history."
1,"Cantet beautifully illuminates what it means sometimes to be inside looking out, and at other times outside looking in."
1,"If you think it's a riot to see Rob Schneider in a young woman's clothes, then you'll enjoy The Hot Chick."
1,"With the same sort of good-natured fun found in films like Tremors, Eight Legged Freaks is prime escapist fare."
0,A bore that tends to hammer home every one of its points.
0,A non-mystery mystery.
1,"There's back-stabbing, inter-racial desire and, most importantly, singing and dancing."
0,There's more repetition than creativity throughout the movie.
1,"Together, Miller, Kuras and the actresses make Personal Velocity into an intricate, intimate and intelligent journey."
1,"I enjoyed the movie in a superficial way, while never sure what its purpose was."
0,Fear Dot Com is more frustrating than a modem that disconnects every 10 seconds.
0,"Instead of a witty expose on the banality and hypocrisy of too much kid-vid, we get an ugly, mean-spirited lashing out by an adult who's apparently been forced by his kids to watch too many Barney videos."
0,"Feels like the work of an artist who is simply tired -- of fighting the same fights, of putting the weight of the world on his shoulders, of playing with narrative form."
0,"It is very difficult to care about the character, and that is the central flaw of the film."
1,"Gangster No. 1 is solid, satisfying fare for adults."
0,Why did they deem it necessary to document all this emotional misery?
1,No doubt the star and everyone else involved had their hearts in the right place.
1,(Rises) above its oh-so-Hollywood rejiggering and its conventional direction to give the film a soul and an unabashed sense of good old-fashioned escapism.
1,"captures that perverse element of the Kafkaesque where identity, overnight, is robbed and replaced with a persecuted ""other."""
1,Never once predictable.
0,"The film doesn't really care about the thousands of Americans who die hideously, it cares about how Ryan meets his future wife and makes his start at the CIA."
1,Offers a guilt-free trip into feel-good territory.
0,"The filmmakers are playing to the Big Boys in New York and L.A. To that end, they mock the kind of folks they don't understand, ones they figure the power-lunchers don't care to understand, either."
0,I wish it would have just gone more over-the-top instead of trying to have it both ways.
0,"The whole affair, true story or not, feels incredibly hokey... (it) comes off like a Hallmark commercial."
1,"The structure is simple, but in its own way, Rabbit-Proof Fence is a quest story as grand as The Lord of the Rings."
0,A puppy dog so desperate for attention it nearly breaks its little neck trying to perform entertaining tricks.
1,Nice piece of work.
0,The events of the film are just so WEIRD that I honestly never knew what the hell was coming next.
0,Episode II-- Attack of the Clones is a technological exercise that lacks juice and delight.
1,"This is a dark, gritty, sometimes funny little gem."
0,"Though there's a clarity of purpose and even-handedness to the film's direction, the drama feels rigged and sluggish."
0,"Noyce's greatest mistake is thinking that we needed sweeping, dramatic, Hollywood moments to keep us"
1,What emerges is an unsettling picture of childhood innocence combined with indoctrinated prejudice.
1,"The 3-D vistas from orbit, with the space station suspended like a huge set of wind chimes over the great blue globe, are stanzas of breathtaking, awe-inspiring visual poetry."
0,"Cacoyannis' vision is far less mature, interpreting the play as a call for pity and sympathy for anachronistic phantasms haunting the imagined glory of their own pasts."
1,Jackie Chan movies are a guilty pleasure - he's easy to like and always leaves us laughing.
1,(Gayton's script) telegraphs every discovery and layers on the gloss of convenience.
1,"I know I shouldn't have laughed, but hey, those farts got to my inner nine-year-old."
0,"...has about 3/4th the fun of its spry 2001 predecessor -- but it's a rushed, slapdash, sequel-for-the-sake- of-a-sequel with less than half the plot and ingenuity."
1,There is a general air of exuberance in All About The Benjamins that's hard to resist.
0,"Plays like one of those conversations that Comic Book Guy on ""The Simpsons"" has."
0,"Dong never pushes for insights beyond the superficial tensions of the dynamic he's dissecting, and the film settles too easily along the contours of expectation."
1,"This charming but slight tale has warmth, wit and interesting characters compassionately portrayed."
0,The movie slides downhill as soon as macho action conventions assert themselves.
1,delightfully rendered
0,"Shows that Jackie Chan is getting older, and that's something I would rather live in denial about"
1,Many insightful moments.
0,"Made to be Jaglomized is the Cannes Film Festival, the annual Riviera spree of flesh, buzz, blab and money."
1,"The performances are immaculate, with Roussillon providing comic relief."
0,"Anyone not into high-tech splatterfests is advised to take the warning literally, and log on to something more user-friendly."
1,Director Claude Chabrol has become the master of innuendo.
1,"As comedic spotlights go, Notorious C.H.O. hits all the verbal marks it should."
0,(Tries) to parody a genre that's already a joke in the United States.
0,"They were afraid to show this movie to reviewers before its opening, afraid of the bad reviews they thought they'd earn."
1,Especially give credit to Affleck.
0,"A fragile framework upon which to hang broad, mildly fleshed-out characters that seem to have been conjured up only 10 minutes prior to filming."
1,And it marks him as one of the most interesting writer/directors working today.
0,"This picture is murder by numbers, and as easy to be bored by as your ABC's, despite a few whopping shootouts."
0,"Though Jones and Snipes are enthralling, the movie bogs down in rhetoric and cliché."
1,"According to Wendigo, 'nature' loves the members of the upper class almost as much as they love themselves."
0,"Even a hardened voyeur would require the patience of Job to get through this interminable, shapeless documentary about the swinging subculture."
1,It is refreshingly undogmatic about its characters.
0,"A gratingly unfunny groaner littered with zero-dimensional, unlikable characters and hackneyed, threadbare comic setups."
1,"A vibrant, colorful, semimusical rendition."
1,"But as you watch the movie, you're too interested to care."
0,"A mediocre exercise in target demographics, unaware that it's the butt of its own joke."
0,Thumbs down.
1,"While the story does seem pretty unbelievable at times, it's awfully entertaining to watch."
0,"At a time when we've learned the hard way just how complex international terrorism is, Collateral Damage paints an absurdly simplistic picture."
0,Upper West Sidey exercise in narcissism and self-congratulation disguised as a tribute.
1,"As a kind of colorful, dramatized PBS program, Frida gets the job done."
0,An uneven look into a grim future that doesn't come close to the level of intelligence and visual splendour that can be seen in other films based on Philip K. Dick stories.
1,"(Shyamalan) turns the goose-pimple genre on its empty head and fills it with spirit, purpose and emotionally bruised characters who add up to more than body count."
0,"Totally overwrought, deeply biased, and wholly designed to make you feel guilty about ignoring what the filmmakers clearly believe are The Greatest Musicians of All Time."
1,There's so much to look at in Metropolis you hate to tear your eyes away from the images long enough to read the subtitles.
0,Woody Allen used to ridicule movies like Hollywood Ending.
1,Lightweight but appealing.
0,There is nothing redeeming about this movie.
0,What's infuriating about Full Frontal is that it's too close to real life to make sense.
1,"The movie's seams may show...but Pellington gives ""Mothman"" an irresistibly uncanny ambience that goes a long way toward keeping the picture compelling."
1,"MacDowell ... gives give a solid, anguished performance that eclipses nearly everything else she's ever done."
1,"Director Paul Cox's unorthodox, abstract approach to visualizing Nijinsky's diaries is both stimulating and demanding."
1,"The sight of the spaceship on the launching pad is duly impressive in IMAX dimensions, as are shots of the astronauts floating in their cabins."
1,"The unique niche of self-critical, behind-the-scenes navel-gazing Kaufman has carved from Orleans' story and his own infinite insecurity is a work of outstanding originality."
1,The stunt work is top-notch; the dialogue and drama often food-spittingly funny.
0,"Lucas has in fact come closer than anyone could desire to the cheap, graceless, hackneyed sci-fi serials of the '30s and '40s."
1,"A fine effort, an interesting topic, some intriguing characters and a sad ending."
0,"""...something appears to have been lost in the translation this time."
1,Featherweight romantic comedy has a few nice twists in a standard plot and the charisma of Hugh Grant and Sandra Bullock.
0,"Hypnotically dull, relentlessly downbeat, laughably predictable wail pitched to the cadence of a depressed fifteen-year-old's suicidal poetry."
1,"Everything about The Quiet American is good, except its timing."
1,"It's a smartly directed, grown-up film of ideas."
1,"The Bourne Identity shouldn't be half as entertaining as it is, but director Doug Liman and his colleagues have managed to pack it with enough action to satisfy the boom-bam crowd without a huge sacrifice of character and mood."
0,"Once he starts learning to compromise with reality enough to become comparatively sane and healthy, the film becomes predictably conventional."
1,"A touching, small-scale story of family responsibility and care in the community."
0,"The gifted Crudup has the perfect face to play a handsome blank yearning to find himself, and his cipherlike personality and bad behavior would play fine if the movie knew what to do with him."
0,An artsploitation movie with too much exploitation and too little art.
0,"Unless you're a fanatic, the best advice is: 'Scooby' don't."
1,"Nicole Kidman evolved from star to superstar some time over the past year, which means that Birthday Girl is the kind of quirkily appealing minor movie she might not make for a while."
1,And the positive change in tone here seems to have recharged him.
1,There's just something about watching a squad of psychopathic underdogs whale the tar out of unsuspecting lawmen that reaches across time and distance.
1,"The script is high on squaddie banter, low on shocks."
0,Go back to sleep.
0,This movie plays like an extended dialogue exercise in Retard 101.
0,"It's as if a bored Cage spent the duration of the film's shooting schedule waiting to scream: ""Got AIDS yet?"""
1,"Secret Ballot is a funny, puzzling movie ambiguous enough to be engaging and oddly moving."
0,"A visionary marvel, but it's lacking a depth in storytelling usually found in anime like this."
0,"Nair just doesn't have the necessary self-control to guide a loose, poorly structured film through the pitfalls of incoherence and redundancy."
1,One of the most slyly exquisite anti-adult movies ever made.
0,This low-rent -- and even lower-wit -- rip-off of the Farrelly brothers' oeuvre gets way too mushy -- and in a relatively short amount of time.
1,Happily stays close to the ground in a spare and simple manner and doesn't pummel us with phony imagery or music.
0,"Fails as a dystopian movie, as a retooling of Fahrenheit 451, and even as a rip-off of The Matrix."
1,"Whatever one makes of its political edge, this is beautiful filmmaking from one of French cinema's master craftsmen."
1,"Jagger, Stoppard and director Michael Apted ... deliver a riveting and surprisingly romantic ride."
0,Banal and predictable.
0,"Takes a clunky TV-movie approach to detailing a chapter in the life of the celebrated Irish playwright, poet and drinker."
0,The trashy teen-sleaze equivalent of Showgirls.
1,"Best of all is Garcia, who perfectly portrays the desperation of a very insecure man."
0,"It doesn't flinch from its unsettling prognosis, namely, that the legacy of war is a kind of perpetual pain."
0,"Scooby-Doo doesn't know if it wants to be a retro-refitting exercise in campy recall for older fans or a silly, Nickelodeon-esque kiddie flick."
0,A dramatic comedy as pleasantly dishonest and pat as any Hollywood fluff.
0,"Unfunny and lacking any sense of commitment to or affection for its characters, the Reginald Hudlin comedy relies on toilet humor, ethnic slurs."
1,"""The best Disney movie since the Lion King"""
1,"Best indie of the year, so far."
0,Feels less like a cousin to Blade Runner than like a bottom-feeder sequel in the Escape From New York series.
0,"It jumps around with little logic or continuity, presenting backstage bytes of information that never amount to a satisfying complete picture of this particular, anciently demanding métier."
1,Simone is not a bad film.
1,"A sexy, peculiar and always entertaining costume drama set in Renaissance Spain, and the fact that it's based on true events somehow makes it all the more compelling."
0,"As the sulking, moody male hustler in the title role, (Franco) has all of Dean's mannerisms and self-indulgence, but none of his sweetness and vulnerability."
1,The first Bond movie in ages that isn't fake fun.
0,"The problem is that for the most part, the film is deadly dull."
0,"For the rest of us, sitting through Dahmer's two hours amounts to little more than punishment."
0,The rollerball sequences feel sanitised and stagey.
1,Ramsay and Morton fill this character study with poetic force and buoyant feeling.
1,The film is saved from aren't-kids-cute sentimentality by a warmth that isn't faked and a stately sense of composition.
1,"Death to Smoochy is often very funny, but what's even more remarkable is the integrity of DeVito's misanthropic vision."
0,The only young people who possibly will enjoy it are infants... who might be distracted by the movie's quick movements and sounds.
0,There's something fishy about a seasonal holiday kids' movie ... that derives its moment of most convincing emotional gravity from a scene where Santa gives gifts to grownups.
0,It collapses when Mr. Taylor tries to shift the tone to a thriller's rush.
0,It's also not smart or barbed enough for older viewers -- not everyone thinks poo-poo jokes are 'edgy.'
0,"It gives poor Dana Carvey nothing to do that is really funny, and then expects us to laugh because he acts so goofy all the time."
1,"Efficient, suitably anonymous chiller."
0,"... Stylistically, the movie is a disaster."
1,"It's mildly entertaining, especially if you find comfort in familiarity."
1,...a guiltless film for nice evening out.
1,"What makes Salton Sea surprisingly engrossing is that Caruso takes an atypically hypnotic approach to a world that's often handled in fast-edit, hopped-up fashion."
0,An opportunity missed.
1,Canada's arctic light shines bright on this frozen tundra soap opera that breathes extraordinary life into the private existence of the Inuit people.
1,"Fresh and raw like a blown-out vein, Narc takes a walking-dead, cop-flick subgenre and beats new life into it."
0,Dignified CEO's meet at a rustic retreat and pee against a tree.
1,"A creepy, intermittently powerful study of a self-destructive man...about as unsettling to watch as an exploratory medical procedure or an autopsy."
