label,sentence
1,Both a successful adaptation and an enjoyable film in its own right.
1,And Vin Diesel is the man.
0,Just a Kiss is a just a waste.
0,Murder by Numbers just doesn't add up.
0,"All three descriptions suit Evelyn, a besotted and obvious drama that tells us nothing new."
1,"This is popcorn movie fun with equal doses of action, cheese, ham and cheek (as well as a serious debt to The Road Warrior), but it feels like unrealized potential"
1,"In Death to Smoochy, we don't get Williams' usual tear and a smile, just sneers and bile, and the spectacle is nothing short of refreshing."
0,An uneven mix of dark satire and childhood awakening.
0,The movie is about as humorous as watching your favorite pet get buried alive.
0,Bears is even worse than I imagined a movie ever could be.
0,Dramatically lackluster.
1,made Eddie Murphy a movie star and the man hasn't aged a day.
1,This is an undeniably intriguing film from an adventurous young talent who finds his inspiration on the fringes of the American underground.
1,"Yes, MIBII is rote work and predictable, but with a philosophical visual coming right at the end that extravagantly redeems it."
0,Their contrast is neither dramatic nor comic -- it's just a weird fizzle.
0,All the characters are clinically depressed and have abandoned their slim hopes and dreams.
0,"Tartakovsky's team has some freakish powers of visual charm, but the five writers slip into the modern rut of narrative banality."
1,"A gently funny, sweetly adventurous film that makes you feel genuinely good, that is to say, entirely unconned by false sentiment or sharp, overmanipulative Hollywood practices."
0,"Tries too hard to be funny in a way that's too loud, too goofy and too short of an attention span."
1,The obnoxious title character provides the drama that gives added clout to this doc.
0,"You emerge dazed, confused as to whether you've seen pornography or documentary."
0,"Lucy's a dull girl, that's all."
1,Sensitive ensemble performances and good period reconstruction add up to a moving tragedy with some buoyant human moments.
0,"Directed without the expected flair or imagination by Hong Kong master John Woo, Windtalkers airs just about every cliche in the war movie compendium across its indulgent two-hour-and-fifteen-minute length."
1,"It looks closely, insightfully at fragile, complex relationships."
0,The story has some nice twists but the ending and some of the back-story is a little tired.
0,is an inexpressible and drab wannabe looking for that exact niche.
0,"The Mothman Prophecies, which is mostly a bore, seems to exist only for its climactic setpiece."
1,"Spirit is a visual treat, and it takes chances that are bold by studio standards, but it lacks a strong narrative."
1,This is one of the rarest kinds of films: a family-oriented non-Disney film that is actually funny without hitting below the belt.
1,"For almost the first two-thirds of Martin Scorsese's 168-minute Gangs of New York, I was entranced."
0,"...a cheap, ludicrous attempt at serious horror."
0,"An unremittingly ugly movie to look at, listen to, and think about, it is quite possibly the sturdiest example yet of why the DV revolution has cheapened the artistry of making a film."
1,Enticing and often funny documentary.
0,But one thing's for sure: It never comes close to being either funny or scary.
0,The movie eventually snaps under the strain of its plot contrivances and its need to reassure.
1,"Whereas Oliver Stone's conspiracy thriller JFK was long, intricate, star-studded and visually flashy, Interview with the Assassin draws its considerable power from simplicity."
1,The Komediant is a tale worth catching.
0,"The holes in this film remain agape -- holes punched through by an inconsistent, meandering, and sometimes dry plot."
1,Worth seeing just for Weaver and LaPaglia.
0,"It follows the Blair Witch formula for an hour, in which we're told something creepy and vague is in the works, and then it goes awry in the final 30 minutes."
1,An encouraging effort from McCrudden
1,"I was amused and entertained by the unfolding of Bielinsky's cleverly constructed scenario, and greatly impressed by the skill of the actors involved in the enterprise."
1,"Such master screenwriting comes courtesy of John Pogue, the Yale grad who previously gave us ""The Skulls"" and last year's ""Rollerball."""
1,"Initially gripping, eventually cloying POW drama."
0,This is not a Jackie Chan movie.
1,Chamber of Secrets will find millions of eager fans.
0,Lacks the visual flair and bouncing bravado that characterizes better hip-hop clips and is content to recycle images and characters that were already tired 10 years ago.
0,"A timid, soggy near miss."
1,"A solidly constructed, entertaining thriller that stops short of true inspiration."
1,A quiet family drama with a little bit of romance and a dose of darkness.
1,"Smith examines the intimate, unguarded moments of folks who live in unusual homes -- which pop up in nearly every corner of the country."
0,"I admire it and yet cannot recommend it, because it overstays its natural running time."
0,Thoroughly engrossing and ultimately tragic.
0,I can analyze this movie in three words: Thumbs Friggin' Down.
0,"If only it were, well, funnier."
0,"It is messy, uncouth, incomprehensible, vicious and absurd."
1,"From its invitingly upbeat overture to its pathos-filled but ultimately life-affirming finale, Martin is a masterfully conducted work."
0,Charly comes off as emotionally manipulative and sadly imitative of innumerable past Love Story derisions.
0,Kung Pow seems like some futile concoction that was developed hastily after Oedekerk and his fellow moviemakers got through crashing a college keg party.
0,"Its premise is smart, but the execution is pretty weary."
1,An engrossing Iranian film about two itinerant teachers and some lost and desolate people they encounter in a place where war has savaged the lives and liberties of the poor and the dispossessed.
0,"for those for whom the name Woody Allen was once a guarantee of something fresh, sometimes funny, and usually genuinely worthwhile, Hollywood Ending is a depressing experience"
0,"Somewhere inside the mess that is World Traveler, there is a mediocre movie trying to get out."
1,"First and foremost...the reason to go see ""Blue Crush"" is the phenomenal, water-born cinematography by David Hennings."
1,Connoisseurs of Chinese film will be pleased to discover that Tian's meticulous talent has not withered during his enforced hiatus.
1,"Gaunt, silver-haired and leonine, (Harris) brings a tragic dimension and savage full-bodied wit and cunning to the aging Sandeman."
1,"Left me with the visceral sensation of longing, lasting traces of Charlotte's web of desire and desperation."
0,"The problem with The Bread, My Sweet is that it's far too sentimental."
1,Combines a comically dismal social realism with a farcically bawdy fantasy of redemption and regeneration.
0,"Loud, chaotic and largely unfunny."
0,"The main characters are simply named The Husband, The Wife and The Kidnapper, emphasizing the disappointingly generic nature of the entire effort."
0,A Movie to Forget
0,Rife with nutty cliches and far too much dialogue.
0,"Starts out with tremendous promise, introducing an intriguing and alluring premise, only to fall prey to a boatload of screenwriting cliches that sink it faster than a leaky freighter."
1,A raunchy and frequently hilarious follow-up to the gifted Korean American stand-up's I'm the One That I Want.
1,"A completely spooky piece of business that gets under your skin and, some plot blips aside, stays there for the duration."
0,An artful yet depressing film that makes a melodramatic mountain out of the molehill of a missing bike.
0,"The movie ends with outtakes in which most of the characters forget their lines and just utter 'uhhh,' which is better than most of the writing in the movie."
0,"If that doesn't clue you in that something's horribly wrong, nothing will."
0,This loud and thoroughly obnoxious comedy about a pair of squabbling working-class spouses is a deeply unpleasant experience.
0,It's not an easy one to review.
0,"Ultimately, in the history of the Academy, people may be wondering what all that jazz was about ""Chicago"" in 2002."
1,The film has a terrific look and Salma Hayek has a feel for the character at all stages of her life.
1,"What makes Barbershop so likable, with all its flaws, is that it has none of the pushiness and decibel volume of most contemporary comedies."
0,"This is for the most part a useless movie, even with a great director at the helm."
1,(Reaches) wholly believable and heart-wrenching depths of despair.
1,"The film fearlessly gets under the skin of the people involved ... This makes it not only a detailed historical document, but an engaging and moving portrait of a subculture."
0,"For a movie about the power of poetry and passion, there is precious little of either."
0,"Unfortunately, we'd prefer a simple misfire."
1,...a true delight.
0,An awful snooze.
0,Doesn't really add up to much.
1,"An interesting psychological game of cat-and-mouse, three-dimensional characters and believable performances all add up to a satisfying crime drama."
1,"A new film from Bill Plympton, the animation master, is always welcome."
0,"Watching ""Ending"" is too often like looking over the outdated clothes and plastic knickknacks at your neighbor's garage sale."
0,"Cox offers plenty of glimpses at existing photos, but there are no movies of Nijinsky, so instead the director treats us to an aimless hodgepodge."
0,"Its weighty themes are too grave for youngsters, but the story is too steeped in fairy tales and other childish things to appeal much to teenagers."
0,"Nothing happens, and it happens to flat characters."
0,Leaves us wondering less about its ideas and more about its characterization of Hitler and the contrived nature of its provocative conclusion.
0,"""White Oleander,"" the movie, is akin to a Reader's Digest condensed version of the source material."
1,"High drama, Disney-style - a wing and a prayer and a hunky has-been pursuing his castle in the sky."
0,"Schnieder bounces around with limp wrists, wearing tight tummy tops and hip huggers, twirling his hair on his finger and assuming that's enough to sustain laughs..."
1,A wonderfully speculative character study that made up for its rather slow beginning by drawing me into the picture.
1,"It's the kind of movie that, aside from Robert Altman, Spike Lee, the Coen Brothers and a few others, our moviemakers don't make often enough."
1,The action sequences are fun and reminiscent of combat scenes from the Star Wars series.
1,"The work of an exhausted, desiccated talent who can't get out of his own way."
0,The problem is that Van Wilder does little that is actually funny with the material.
0,No cliche escapes the perfervid treatment of gang warfare called ces Wild.
0,Comes off like a bad imitation of the Bard.
0,The Sweetest Thing leaves an awful sour taste.
1,It's a great American adventure and a wonderful film to bring to IMAX.
0,Resembles a soft porn Brian De Palma pastiche.
1,A uniquely sensual metaphorical dramatization of sexual obsession that spends a bit too much time on its fairly ludicrous plot.
1,The sentimental cliches mar an otherwise excellent film.
0,Hollywood has taken quite a nosedive from Alfred Hitchcock's imaginative flight to Shyamalan's self-important summer fluff.
0,This is standard crime drama fare... instantly forgettable and thoroughly dull.
1,Eyre is on his way to becoming the American Indian Spike Lee.
1,"In questioning the election process, Payami graphically illustrates the problems of fledgling democracies, but also the strength and sense of freedom the Iranian people already possess, with or without access to the ballot box."
0,"There's a scientific law to be discerned here that producers would be well to heed: Mediocre movies start to drag as soon as the action speeds up; when the explosions start, they fall to pieces."
0,"Borstal Boy represents the worst kind of filmmaking, the kind that pretends to be passionate and truthful but is really frustratingly timid and soggy."
1,"So genial is the conceit, this is one of those rare pictures that you root for throughout, dearly hoping that the rich promise of the script will be realized on the screen."
0,The only entertainment you'll derive from this choppy and sloppy affair will be from unintentional giggles – several of them.
0,The Good Girl is a film in which the talent is undeniable but the results are underwhelming.
0,More of the same old garbage Hollywood has been trying to pass off as acceptable teen entertainment for some time now.
1,Amazingly dopey.
0,The Christ allegory doesn't work because there is no foundation for it
0,Romanek keeps adding flourishes -- artsy fantasy sequences -- that simply feel wrong.
1,"Combines improbable melodrama (gored bullfighters, comatose ballerinas) with subtly kinky bedside vigils and sensational denouements, and yet at the end, we are undeniably touched."
1,"You don't need to be a hip-hop fan to appreciate Scratch, and that's the mark of a documentary that works."
0,"I'm not sure which half of Dragonfly is worse: The part where nothing's happening, or the part where something's happening, but it's stupid."
1,"Writer/director David Caesar ladles on the local flavour with a hugely enjoyable film about changing times, clashing cultures and the pleasures of a well-made pizza."
1,"The journey to the secret's eventual discovery is a separate adventure, and thrill enough."
0,Roman Polanski directs The Pianist like a surgeon mends a broken heart; very meticulously but without any passion.
1,"It's soulful and unslick, and that's apparently just what (Aniston) has always needed to grow into a movie career."
1,"Like blended shades of lipstick, these components combine into one terrific story with lots of laughs."
1,Devos delivers a perfect performance that captures the innocence and budding demons within a wallflower.
0,Has lost some of the dramatic conviction that underlies the best of comedies...
1,"Tells a fascinating, compelling story."
0,"Like a comedian who starts off promisingly but then proceeds to flop, Comedian runs out of steam after a half hour."
0,"One of those films where the characters inhabit that special annex of hell where adults behave like kids, children behave like adults and everyone screams at the top of their lungs no matter what the situation."
0,"Devotees of Star Trek II: The Wrath of Khan will feel a nagging sense of deja vu, and the grandeur of the best Next Generation episodes is lacking."
1,Beautifully reclaiming the story of Carmen and recreating it an in an African idiom.
0,"The punch lines that miss, unfortunately, outnumber the hits by three-to-one."
1,Michel Piccoli's moving performance is this films reason for being.
1,Read My Lips is to be viewed and treasured for its extraordinary intelligence and originality as well as its lyrical variations on the game of love.
0,Those seeking a definitive account of Eisenstein's life would do better elsewhere.
1,"Yes, soar."
1,"As banal as the telling may be -- and at times, All My Loved Ones more than flirts with kitsch -- the tale commands attention."
1,"Although Frailty fits into a classic genre, in its script and execution it is a remarkably original work."
0,Naipaul fans may be disappointed.
0,Attal pushes too hard to make this a comedy or serious drama.
1,"Poignant and moving, A Walk to Remember is an inspirational love story, capturing the innocence and idealism of that first encounter."
0,"In any case, I would recommend Big Bad Love only to Winger fans who have missed her since 1995's Forget Paris."
1,"... by the time it's done with us, Mira Nair's new movie has its audience giddy with the delight of discovery, of having been immersed in a foreign culture only to find that human nature is pretty much the same all over."
0,"If there's a heaven for bad movies, Deuces Wild is on its way."
1,"A huge box-office hit in Korea, Shiri is a must for genre fans."
1,"Clint Eastwood's Blood Work is a lot like a well-made PB& J sandwich: familiar, fairly uneventful and boasting no real surprises – but still quite tasty and inviting all the same."
0,The thing about guys like Evans is this: You're never quite sure where self-promotion ends and the truth begins.
0,I found myself growing more and more frustrated and detached as Vincent became more and more abhorrent.
0,It's like an all-star salute to Disney's cheesy commercialism.
0,"Like a bad improvisation exercise, the superficially written characters ramble on tediously about their lives, loves and the art they're struggling to create."
0,"Though her fans will assuredly have their funny bones tickled, others will find their humor-seeking dollars best spent elsewhere."
0,The first Fatal Attraction was vile enough.
1,A sentimental but entirely irresistible portrait of three aging sisters.
1,"Measured against practically any like-themed film other than its Oscar-sweeping franchise predecessor The Silence of the Lambs, Red Dragon rates as an exceptional thriller."
0,"And as with most late-night bull sessions, eventually the content isn't nearly as captivating as the rowdy participants think it is."
1,...a quietly introspective portrait of the self-esteem of employment and the shame of losing a job...
1,Garcia and the other actors help make the wobbly premise work.
0,It's just plain lurid when it isn't downright silly.
0,Friday After Next is the kind of film that could only be made by African-Americans because of its broad racial insensitivity towards African-Americans.
1,It is also beautifully acted.
0,This dubious product of a college-spawned (Colgate U.) comedy ensemble known as Broken Lizard plays like a mix of Cheech and Chong and CHiPs.
1,"All three actresses are simply dazzling, particularly Balk, who's finally been given a part worthy of her considerable talents."
1,...a powerful sequel and one of the best films of the year.
1,"It's about individual moments of mood, and an aimlessness that's actually sort of amazing."
1,A gift to anyone who loves both dance and cinema
0,"Such a wildly uneven hit-and-miss enterprise, you can't help suspecting that it was improvised on a day-to-day basis during production."
0,The new film of Anton Chekhov's The Cherry Orchard puts the 'ick' in 'classic.'
0,"Poor editing, bad bluescreen, and ultra-cheesy dialogue highlight the radical action."
0,"If Welles was unhappy at the prospect of the human race splitting in two, he probably wouldn't be too crazy with his great-grandson's movie splitting up in pretty much the same way."
1,"Passions, obsessions, and loneliest dark spots are pushed to their most virtuous limits, lending the narrative an unusually surreal tone."
1,"Definitely a crowd-pleaser, but then, so was the Roman Colosseum."
1,This story of a determined woman's courage to find her husband in a war zone offers winning performances and some effecting moments.
0,"Well made but uninvolving, Bloodwork isn't a terrible movie, just a stultifyingly obvious one -- an unrewarding collar for a murder mystery."
0,"... expands the horizons of boredom to the point of collapse, turning into a black hole of dullness, from which no interesting concept can escape."
0,As steamy as last week's pork dumplings.
1,"The story itself it mostly told through on-camera interviews with several survivors, whose riveting memories are rendered with such clarity that it's as if it all happened only yesterday."
1,"The Movie is clever, offbeat and even gritty enough to overcome my resistance."
0,"Another week, another gross-out college comedy--ugh."
0,"A laughable -- or rather, unlaughable -- excuse for a film."
0,Too silly to take seriously.
0,Low comedy doesn't come much lower.
1,It's a very tasteful rock and roll movie.
1,"Meticulously mounted, exasperatingly well-behaved film, which ticks off Kahlo's lifetime milestones with the dutiful precision of a tax accountant."
1,"Davis' candid, archly funny and deeply authentic take on intimate relationships comes to fruition in her sophomore effort."
1,A fast paced and suspenseful Argentinian thriller about the shadow side of play.
0,"Ultimately the, yes, snail-like pacing and lack of thematic resonance make the film more silly than scary, like some sort of Martha Stewart decorating program run amok."
0,Sewer rats could watch this movie and be so skeeved out that they'd need a shower.
1,Hard to resist.
0,"There's an excellent 90-minute film here; unfortunately, it runs for 170."
1,"Director Carl Franklin, so crisp and economical in One False Move, bogs down in genre cliches here."
1,"Like a precious and finely cut diamond, magnificent to behold in its sparkling beauty yet in reality it's one tough rock."
0,"No cute factor here... Not that I mind ugly; the problem is he has no character, loveable or otherwise."
0,Suffers from its timid parsing of the barn-side target of sons trying to breach gaps in their relationships with their fathers.
0,It's a Frankenstein-monster of a film that doesn't know what it wants to be.
0,An incredibly narrow in-joke targeted to the tiniest segment of an already obscure demographic.
1,"A knowing look at female friendship, spiked with raw urban humor."
1,...begins on a high note and sustains it beautifully.
1,"The overall result is an intelligent, realistic portrayal of testing boundaries."
1,"Quaid is utterly fearless as the tortured husband living a painful lie, and Moore wonderfully underplays the long-suffering heroine with an unflappable '50s dignity somewhere between Jane Wyman and June Cleaver."
0,"Most of the problems with the film don't derive from the screenplay, but rather the mediocre performances by most of the actors involved"
1,A poignant comedy that offers food for thought.
0,"Deuces Wild treads heavily into Romeo and Juliet/West Side Story territory, where it plainly has no business going."
0,"There is no psychology here, and no real narrative logic -- just a series of carefully choreographed atrocities, which become strangely impersonal and abstract."
1,"Secretary manages a neat trick, bundling the flowers of perversity, comedy and romance into a strangely tempting bouquet of a movie."
0,Everything about it from the bland songs to the colorful but flat drawings is completely serviceable and quickly forgettable.
1,"This fascinating experiment plays as more of a poetic than a strict reality, creating an intriguing species of artifice that gives The Lady and the Duke something of a theatrical air."
0,A few pieces of the film buzz and whir; very little of it actually clicks.
0,Ah-nuld's action hero days might be over.
0,"The movie has a script (by Paul Pender) made of wood, and it's relentlessly folksy, a procession of stagy set pieces stacked with binary oppositions."
1,The filmmakers' eye for detail and the high standards of performance convey a strong sense of the girls' environment.
1,It also shows how deeply felt emotions can draw people together across the walls that might otherwise separate them.
0,Even accepting this in the right frame of mind can only provide it with so much leniency.
1,"It's at once laughable and compulsively watchable, in its committed dumbness."
0,They threw loads of money at an idea that should've been so much more even if it was only made for teenage boys and wrestling fans.
1,"-West Coast rap wars, this modern mob music drama never fails to fascinate."
1,"As part of Mr. Dong's continuing exploration of homosexuality in America, Family Fundamentals is an earnest study in despair."
0,"A movie more to be prescribed than recommended -- as visually bland as a dentist's waiting room, complete with soothing Muzak and a cushion of predictable narrative rhythms."
1,"All in all, Brown Sugar is a satisfying well-made romantic comedy that's both charming and well acted."
1,Represents a worthy departure from the culture clash comedies that have marked an emerging Indian American cinema.
0,So bland and utterly forgettable that it might as well have been titled Generic Jennifer Lopez Romantic Comedy.
1,A comedy that swings and jostles to the rhythms of life.
1,A stylish thriller.
1,"Constantly touching, surprisingly funny, semi-surrealist exploration of the creative act."
1,"Birthday Girl doesn't try to surprise us with plot twists, but rather seems to enjoy its own transparency."
0,A poky and pseudo-serious exercise in sham actor workshops and an affected malaise.
1,"That rare movie that works on any number of levels -- as a film of magic and whimsy for children, a heartfelt romance for teenagers and a compelling argument about death, both pro and con, for adults."
1,The universal theme of becoming a better person through love has never been filmed more irresistibly than in 'Baran.'
0,There's got to be a more graceful way of portraying the devastation of this disease.
1,"Unfolds as one of the most politically audacious films of recent decades from any country, but especially from France."
1,"The Rock is destined to be the 21st Century's new ""Conan"" and that he's going to make a splash even greater than Arnold Schwarzenegger, Jean-Claud Van Damme or Steven Segal."
0,"Adults, other than the parents...will be hard pressed to succumb to the call of the wild."
0,"Here, alas, it collapses like an overcooked soufflé."
0,"Plays like one long, meandering sketch inspired by the works of John Waters and Todd Solondz, rather than a fully developed story."
0,Snow Dogs finds its humour in a black man getting humiliated by a pack of dogs who are smarter than him
1,"Before it takes a sudden turn and devolves into a bizarre sort of romantic comedy, Steven Shainberg's adaptation of Mary Gaitskill's harrowing short story ... is a brilliantly played, deeply unsettling experience."
1,"... very funny, very enjoyable ..."
0,The hackneyed story about an affluent damsel in distress who decides to fight her bully of a husband is simply too overdone.
