label,sentence
0,"A long, dull procession of despair, set to cello music culled from a minimalist funeral."
1,"The concert footage is stirring, the recording sessions are intriguing, and -- on the way to striking a blow for artistic integrity -- this quality band may pick up new admirers."
0,Most of the dialogue made me want to pack raw dough in my ears.
0,Queen of the Damned is too long with too little going on.
1,"It ain't art, by a long shot, but unlike last year's lame Musketeer, this Dumas adaptation entertains."
1,Campanella's competent direction and his excellent cast overcome the obstacles of a predictable outcome and a screenplay that glosses over Rafael's evolution.
1,Schütte's dramatic snapshot of the artist three days before his death offers an interesting bit of speculation as to the issues Brecht faced as his life drew to a close.
1,"Would be an unendurable viewing experience for this ultra-provincial New Yorker if 26-year-old Reese Witherspoon were not on hand to inject her pure fantasy character, Melanie Carmichael, with a massive infusion of old-fashioned Hollywood magic."
0,"A horror movie with seriously dumb characters, which somewhat dilutes the pleasure of watching them stalked by creepy-crawly bug things that live only in the darkness."
0,Their parents would do well to cram earplugs in their ears and put pillowcases over their heads for 87 minutes.
0,Cloaks a familiar anti-feminist equation (career - kids = misery) in tiresome romantic-comedy duds.
1,Naomi Watts is terrific as Rachel; her petite frame and vulnerable persona emphasising her plight and isolation.
0,Idiotic and ugly.
1,"'Film aficionados cannot help but love Cinema Paradiso, whether the original version or new Director's Cut.'"
1,"Hard, endearing, caring, warm."
0,The major problem with Windtalkers is that the bulk of the movie centers on the wrong character.
0,-greaseballs mob action-comedy.
1,Writer and director Otar Iosseliani's pleasant tale about a factory worker who escapes for a holiday in Venice reveals how we all need a playful respite from the grind to refresh our souls.
1,"A refreshingly realistic, affectation-free coming-of-age tale."
1,"""Simone"" is a fun and funky look into an artificial creation in a world that thrives on artificiality."
0,"Supposedly, Pokemon can't be killed, but Pokemon 4Ever practically assures that the pocket monster movie franchise is nearly ready to keel over."
0,"The acting is amateurish, the cinematography is atrocious, the direction is clumsy, the writing is insipid and the violence is at once luridly graphic and laughably unconvincing."
1,You have to see it.
1,Pray has really done his subject justice.
0,"Woody, what happened?"
0,But it's also disappointing to a certain degree.
0,"Coarse, cliched and clunky, this trifling romantic comedy in which opposites attract for no better reason than that the screenplay demands it squanders the charms of stars Hugh Grant and Sandra Bullock."
0,Bears about as much resemblance to the experiences of most battered women as Spider-Man does to the experiences of most teenagers.
1,"At times a bit melodramatic and even a little dated (depending upon where you live), Ignorant Fairies is still quite good-natured and not a bad way to spend an hour or two."
0,"A boring masquerade ball where normally good actors, even Kingsley, are made to look bad."
0,A semi-autobiographical film that's so sloppily written and cast that you cannot believe anyone more central to the creation of Bugsy than the caterer had anything to do with it.
0,The skills of a calculus major at M.I.T. are required to balance all the formulaic equations in the long-winded heist comedy Who Is Cletis Tout?
0,"Though there are entertaining and audacious moments, the movie's wildly careening tone and an extremely flat lead performance do little to salvage this filmmaker's flailing reputation."
1,"Efteriades gives the neighborhood -- scenery, vibe and all -- the cinematic equivalent of a big, tender hug."
1,Two Weeks Notice has appeal beyond being a Sandra Bullock vehicle or a standard romantic comedy.
1,"Could use a little more humanity, but it never lacks in eye-popping visuals."
1,"The leads are natural and lovely, the pace is serene, the humor wry and sprightly."
0,"Offers big, fat, dumb laughs that may make you hate yourself for giving in."
1,Hardly a film that comes along every day.
1,Definitely worth 95 minutes of your time.
1,Certainly the big finish wasn't something Galinsky and Hawley could have planned for... but part of being a good documentarian is being there when the rope snaps.
0,"Rollerball IS as bad as you think, and worse than you can imagine."
0,"There's the plot, and a maddeningly insistent and repetitive piano score that made me want to scream."
0,"It would be great to see this turd squashed under a truck, preferably a semi."
0,"The pacing is deadly, the narration helps little and Naipaul, a juicy writer, is negated."
1,I'm going to give it a marginal thumbs up.
1,This beautifully animated epic is never dull.
0,"Human Nature, in short, isn't nearly as funny as it thinks it is; neither is it as smart."
1,Davis ... gets vivid performances from her cast and pulls off some deft Ally McBeal-style fantasy sequences.
0,"Even in the summertime, the most restless young audience deserves the dignity of an action hero motivated by something more than franchise possibilities."
1,A mesmerizing cinematic poem from the first frame to the last.
0,"The setting turns out to be more interesting than any of the character dramas, which never reach satisfying conclusions."
0,This painfully unfunny farce traffics in tired stereotypes and encumbers itself with complications ... that have no bearing on the story.
1,Take nothing seriously and enjoy the ride.
1,"It is different from others in its genre in that it is does not rely on dumb gags, anatomical humor, or character cliches; it primarily relies on character to tell its story."
1,"Still rapturous after all these years, Cinema Paradiso stands as one of the great films about movie love."
1,Be patient with the lovely Hush!
1,"The actors are simply too good, and the story too intriguing, for technical flaws to get in the way."
1,I'd be lying if I said my ribcage didn't ache by the end of Kung Pow.
1,It may also be the best sex comedy about environmental pollution ever made.
1,"An entertaining, if ultimately minor, thriller."
1,"And the reason for that is a self-aware, often self-mocking, intelligence."
0,Whether Jason X is this bad on purpose is never clear.
0,"All comedy is subversive, but this unrelenting bleak insistence on opting out of any opportunity for finding meaning in relationships or work just becomes sad."
0,"The movie is concocted and carried out by folks worthy of scorn, and the nicest thing I can say is that I can't remember a single name responsible for it."
0,All too familiar...basically the sort of cautionary tale that was old when 'Angels With Dirty Faces' appeared in 1938.
0,Seems like something American and European gay movies were doing 20 years ago.
0,"This is a truly, truly bad movie."
1,"The way the roundelay of partners functions, and the interplay within partnerships and among partnerships and the general air of Gator-bashing are consistently delightful."
0,What 'Blade Runner' would've looked like as a low-budget series on a UHF channel.
0,There is a difference between movies with the courage to go over the top and movies that don't care about being stupid
1,An ebullient Tunisian film about the startling transformation of a tradition-bound widow who is drawn into the exotic world of belly dancing.
1,A lovely film for the holiday season.
1,"After one gets the feeling that the typical Hollywood disregard for historical truth and realism is at work here, it's a matter of finding entertainment in the experiences of Zishe and the fiery presence of Hanussen."
1,"Tadpole may be one of the most appealing movies ever made about an otherwise appalling, and downright creepy, subject -- a teenage boy in love with his stepmother."
1,"A film centering on a traditional Indian wedding in contemporary New Delhi may not sound like specialized fare, but Mira Nair's film is an absolute delight for all audiences."
1,"The most amazing super-sized dosage of goofball stunts any ""Jackass"" fan could want."
1,"K-19: The Widowmaker is derivative, overlong, and bombastic -- yet surprisingly entertaining."
0,"Every visual joke is milked, every set-up obvious and lengthy, every punchline predictable."
0,"By that measure, it is a failure."
0,"Rather than real figures, Elling and Kjell Bjarne become symbolic characters whose actions are supposed to relate something about the naïf's encounter with the world."
1,"Seeing as the film lacks momentum and its position remains mostly undeterminable, the director's experiment is a successful one."
0,...a pretentious mess...
0,"Full of flatulence jokes and mild sexual references, Kung Pow!"
0,"So mind-numbingly awful that you hope Britney won't do it one more time, as far as movies are concerned."
1,"Laced with liberal doses of dark humor, gorgeous exterior photography, and a stable-full of solid performances, No Such Thing is a fascinating little tale."
1,"In the new release of Cinema Paradiso, the tale has turned from sweet to bittersweet, and when the tears come during that final, beautiful scene, they finally feel absolutely earned."
1,Remove Spider-Man the movie from its red herring surroundings and it's apparent that this is one summer film that satisfies.
0,"Spectators will indeed sit open-mouthed before the screen, not screaming but yawning."
1,", The Sum of All Fears is simply a well-made and satisfying thriller."
1,What makes the movie special is its utter sincerity.
0,The thing just never gets off the ground.
0,"After several scenes of this tacky nonsense, you'll be wistful for the testosterone-charged wizardry of Jerry Bruckheimer productions, especially because Half Past Dead is like The Rock on a Wal-Mart budget."
1,The film oozes craft.
0,"Once the expectation of laughter has been quashed by whatever obscenity is at hand, even the funniest idea isn't funny."
1,"Funny, sexy, devastating and incurably romantic."
0,"An ambitious, guilt-suffused melodrama crippled by poor casting."
0,This is an exercise not in biography but in hero worship.
0,The densest distillation of Roberts' movies ever made.
1,"With this masterful, flawless film, (Wang) emerges in the front ranks of China's now numerous, world-renowned filmmakers."
1,A live-wire film that never loses its ability to shock and amaze.
0,"Throughout all the tumult, a question comes to mind: So why is this so boring?"
1,The large-format film is well suited to capture these musicians in full regalia and the incredible IMAX sound system lets you feel the beat down to your toes.
1,"A finely tuned mood piece, a model of menacing atmosphere."
1,"It's packed with adventure and a worthwhile environmental message, so it's great for the kids."
0,Too bad Maggio couldn't come up with a better script.
1,"Sensual, funny and, in the end, very touching."
1,"A movie just for Friday fans, critics be damned."
1,It's a fairy tale that comes from a renowned Indian film culture that allows Americans to finally revel in its splendor.
0,All mood and no movie.
1,"Will assuredly rank as one of the cleverest, most deceptively amusing comedies of the year."
0,A half-assed film.
1,"It's truly awful and heartbreaking subject matter, but one whose lessons are well worth revisiting as many times as possible."
1,The most ingenious film comedy since Being John Malkovich.
1,"The cast is phenomenal, especially the women."
1,"Inventive, fun, intoxicatingly sexy, violent, self-indulgent and maddening."
1,"Much of it comes from the brave, uninhibited performances by its lead actors."
0,A chiller resolutely without chills.
0,"The first hour is tedious though Ford and Neeson capably hold our interest, but its just not a thrilling movie."
1,And it is.
1,"Even when it drags, we are forced to reflect that its visual imagination is breathtaking"
0,Imperfect?
0,This mess of a movie is nothing short of a travesty of a transvestite comedy.
0,"A baffling subplot involving smuggling drugs inside Danish cows falls flat, and if you're going to alter the Bard's ending, you'd better have a good alternative."
0,There's surely something wrong with a comedy where the only belly laughs come from the selection of outtakes tacked onto the end credits.
1,"No, it's not as single-minded as John Carpenter's original, but it's sure a lot smarter and more unnerving than the sequels."
1,"Beating the Austin Powers films at their own game, this blaxploitation spoof downplays the raunch in favor of gags that rely on the strength of their own cleverness as opposed to the extent of their outrageousness."
0,"Viewers are asked so often to suspend belief that were it not for Holm's performance, the film would be a total washout."
0,"There's no palpable chemistry between Lopez and male lead Ralph Fiennes, plus the script by Working Girl scribe Kevin Wade is workmanlike in the extreme."
0,-spy action flick with Antonio Banderas and Lucy Liu never comes together.
0,There's already been too many of these films...
1,We want the funk - and this movie's got it.
1,"(A) thoughtful, visually graceful work."
0,Shows moments of promise but ultimately succumbs to cliches and pat storytelling.
1,"Like The Rugrats movies, The Wild Thornberrys Movie doesn't offer much more than the series, but its emphasis on caring for animals and respecting other cultures is particularly welcome."
0,"A waterlogged version of 'Fatal Attraction' for the teeny-bopper set...a sad, soggy potboiler that wastes the talents of its attractive young leads."
0,"The film starts promisingly, but the ending is all too predictable and far too cliched to really work."
1,The script manages the rare trick of seeming at once both refreshingly different and reassuringly familiar.
1,Kudos to the most enchanting film of the year.
1,The engagingly primitive animated special effects contribute to a mood that's sustained through the surprisingly somber conclusion.
1,"By its modest, straight-ahead standards, Undisputed scores a direct hit."
1,I'm guessing the director is a magician.
1,A dashing and absorbing outing with one of France's most inventive directors.
0,"It irritates and saddens me that Martin Lawrence's latest vehicle can explode obnoxiously into 2,500 screens while something of Bubba Ho-Tep's clearly evident quality may end up languishing on a shelf somewhere."
0,That chirpy songbird Britney Spears has popped up with more mindless drivel.
0,None of the characters or plot-lines are fleshed-out enough to build any interest.
1,"When all is said and done, she loves them to pieces -- and so, I trust, will you."
0,"Ultimately too repellent to fully endear itself to American art house audiences, but it is notable for its stylistic austerity and forcefulness."
0,"Kids don't mind crappy movies as much as adults, provided there's lots of cute animals and clumsy people."
0,"It forces you to watch people doing unpleasant things to each other and themselves, and it maintains a cool distance from its material that is deliberately unsettling."
1,"Wonder, hope and magic can never escape the heart of the boy when the right movie comes along, especially if it begins with the name of Star Wars"
0,"While the performances are often engaging, this loose collection of largely improvised numbers would probably have worked better as a one-hour TV documentary."
0,"Haneke's script (from Elfriede Jelinek's novel) is contrived, unmotivated, and psychologically unpersuasive, with an inconclusive ending."
0,There is only so much baked cardboard I need to chew.
0,"The movie is loaded with good intentions, but in his zeal to squeeze the action and our emotions into the all-too-familiar dramatic arc of the Holocaust escape story, Minac drains his movie of all individuality."
1,"Tully is worth a look for its true-to-life characters, its sensitive acting, its unadorned view of rural life and the subtle direction of first-timer Hilary Birmingham."
1,Filmmaker Tian Zhuangzhuang triumphantly returns to narrative filmmaking with a visually masterful work of quiet power.
0,"...a movie that, quite simply, shouldn't have been made."
1,"The Importance of Being Earnest, so thick with wit it plays like a reading from Bartlett's Familiar Quotations"
0,Five screenwriters are credited with the cliché-laden screenplay; it seems as if each watered down the version of the one before.
1,"Director Alfonso Cuaron gets vivid, convincing performances from a fine cast, and generally keeps things going at a rapid pace, occasionally using an omniscient voice-over narrator in the manner of French New Wave films."
1,... manages to deliver a fair bit of vampire fun.
0,Guys say mean things and shoot a lot of bullets.
0,"Wewannour money back, actually."
1,"More than anything else, Kissing Jessica Stein injects freshness and spirit into the romantic comedy genre, which has been held hostage by generic scripts that seek to remake Sleepless in Seattle again and again."
1,"When cowering and begging at the feet a scruffy Giannini, Madonna gives her best performance since Abel Ferrara had her beaten to a pulp in his Dangerous Game."
1,The sheer joy and pride they took in their work -- and in each other -- shines through every frame.
0,The cumulative effect of the movie is repulsive and depressing.
1,... digs beyond the usual portrayals of good kids and bad seeds to reveal a more ambivalent set of characters and motivations.
1,Much of All About Lily Chou-Chou is mesmerizing: some of its plaintiveness could make you weep.
1,"It's a rollicking adventure for you and all your mateys, regardless of their ages."
0,An empty shell of an epic rather than the real deal.
1,(Scherfig) has made a movie that will leave you wondering about the characters' lives after the clever credits roll.
1,"It may be a somewhat backhanded compliment to say that the film makes the viewer feel like the movie's various victimized audience members after a while, but it also happens to be the movie's most admirable quality"
1,A delightful entree in the tradition of food movies.
0,"(Johnnie To and Wai Ka Fai are) sure to find an enthusiastic audience among American action-adventure buffs, but the film's interests may be too narrow to attract crossover viewers."
1,"Conceptually brilliant...Plays like a living-room War Of The Worlds, gaining most of its unsettling force from the suggested and the unknown."
0,This feature is about as necessary as a hole in the head
1,"(Danny Huston gives) an astounding performance that deftly, gradually reveals a real human soul buried beneath a spellbinding serpent's smirk."
1,"In addition to Hoffman's powerful acting clinic, this is that rare drama that offers a thoughtful and rewarding glimpse into the sort of heartache everyone has felt, or will feel someday."
1,"This isn't exactly profound cinema, but it's good-natured and sometimes quite funny."
1,"Hailed as a clever exercise in neo-Hitchcockianism, this clever and very satisfying picture is more accurately Chabrolian."
0,"It leers, offering next to little insight into its intriguing subject."
0,"A pleasant and engaging enough sit, but in trying to have the best of both worlds it ends up falling short as a whole."
1,"Touches smartly and wistfully on a number of themes, not least the notion that the marginal members of society ... might benefit from a helping hand and a friendly kick in the pants."
1,"Yakusho, as always, is wonderful as the long-faced sad sack ... and his chemistry with Shimizu is very believable."
1,"works, it's thanks to Huston's revelatory performance."
0,Ararat feels like a book report
0,"The beautiful images and solemn words cannot disguise the slack complacency of (Godard's) vision, any more than the gorgeous piano and strings on the soundtrack can drown out the tinny self-righteousness of his voice."
1,"Tully is in many ways the perfect festival film: a calm, self-assured portrait of small town regret, love, duty and friendship that appeals to the storytelling instincts of a slightly more literate filmgoing audience."
0,It's a shame the marvelous first 101 minutes have to be combined with the misconceived final 5.
1,A surprisingly charming and even witty match for the best of Hollywood's comic-book adaptations.
0,My advice is to skip the film and pick up the soundtrack.
1,Audacious-impossible yet compelling...
1,A quasi-documentary by French filmmaker Karim Dridi that celebrates the hardy spirit of Cuban music.
1,Family fare.
0,"The movie resolutely avoids all the comic possibilities of its situation, and becomes one more dumb high school comedy about sex gags and prom dates."
1,"One of recent memory's most thoughtful films about art, ethics, and the cost of moral compromise."
1,"Even if you're an agnostic carnivore, you can enjoy much of Jonah simply, and gratefully, as laugh-out-loud lunacy with a pronounced Monty Pythonesque flavor."
1,One of the best of a growing strain of daring films ... that argue that any sexual relationship that doesn't hurt anyone and works for its participants is a relationship that is worthy of our respect.
0,Set in a 1986 Harlem that doesn't look much like anywhere in New York.
0,"In the spirit of the season, I assign one bright shining star to Roberto Benigni's Pinocchio -- but I guarantee that no wise men will be following after it."
1,"Evokes a palpable sense of disconnection, made all the more poignant by the incessant use of cell phones."
0,"They crush each other under cars, throw each other out windows, electrocute and dismember their victims in full consciousness."
1,"In addition to scoring high for originality of plot -- putting together familiar themes of family, forgiveness and love in a new way -- Lilo & Stitch has a number of other assets to commend it to movie audiences both innocent and jaded."
1,"Perhaps it's cliche to call the film 'refreshing,' but it is."
0,"As predictable as the outcome of a Globetrotters-Generals game, Juwanna Mann is even more ludicrous than you'd expect from the guy-in-a-dress genre, and a personal low for everyone involved."
1,Almodovar is an imaginative teacher of emotional intelligence in this engaging film about two men who discover what William James once called 'the gift of tears.'
1,"A fantastically vital movie that manages to invest real humor, sensuality, and sympathy into a story about two adolescent boys."
0,"...the story is far-flung, illogical, and plain stupid."
1,"And Lee seems just as expectant of an adoring, wide-smiling reception."
0,"It's all arty and jazzy and people sit and stare and turn away from one another instead of talking and it's all about the silences and if you're into that, have at it."
1,An old-fashioned drama of substance about a teacher's slide down the slippery slope of dishonesty after an encounter with the rich and the powerful who have nothing but disdain for virtue.
0,Another useless recycling of a brutal mid-'70s American sports movie.
0,The kind of movie that leaves vague impressions and a nasty aftertaste but little clear memory of its operational mechanics.
1,Hartley adds enough quirky and satirical touches in the screenplay to keep the film entertaining.
1,"As literary desecrations go, this makes for perfectly acceptable, occasionally very enjoyable children's entertainment."
0,This insufferable movie is meant to make you think about existential suffering.
1,"Goofy, nutty, consistently funny."
0,"Two big things are missing -- anything approaching a visceral kick, and anything approaching even a vague reason to sit through it all."
1,"If ""Lilo & Stitch"" isn't the most edgy piece of Disney animation to hit the silver screen, then this first film to use a watercolor background since ""Dumbo"" certainly ranks as the most original in years."
1,"While it has definite weaknesses -- like a rather unbelievable love interest and a meandering ending -- this '60s caper film is a riveting, brisk delight."
1,"It's a talking head documentary, but a great one."
0,An extremely unpleasant film.
1,"Director Juan Jose Campanella could have turned this into an Argentine retread of ""Iris"" or ""American Beauty,"" but instead pulls a little from each film and creates something more beautiful than either of those films."
0,Not good enough to pass for a litmus test of the generation gap and not bad enough to repulse any generation of its fans.
0,"After seeing the film, I can tell you that there's no other reason why anyone should bother remembering it."
0,"It stars schticky Chris Rock and stolid Anthony Hopkins, who seem barely in the same movie."
0,"Merely (and literally) tosses around sex toys and offers half-hearted paeans to empowerment that are repeatedly undercut by the brutality of the jokes, most at women's expense."
0,Terrible.
0,"Throwing in everything except someone pulling the pin from a grenade with his teeth, Windtalkers seems to have ransacked every old World War II movie for overly familiar material."
0,Chai's structure and pacing are disconcertingly slack.
1,If you grew up on Scooby -- you'll love this movie.
1,"Enjoyably fast-moving, hard-hitting documentary."
1,"If you come from a family that eats, meddles, argues, laughs, kibbitzes and fights together, then go see this delightful comedy."
0,"The director mostly plays it straight, turning Leys' fable into a listless climb down the social ladder."
0,Millions of dollars heaped upon a project of such vast proportions need to reap more rewards than spiffy bluescreen technique and stylish weaponry.
0,"Any film that doesn't even in passing mention political prisoners, poverty and the boat loads of people who try to escape the country is less a documentary and more propaganda by way of a valentine sealed with a kiss."
0,It's depressing to see how far Herzog has fallen.
